Product_name,Price
Yeston Radeon R7 350-4G 6HDMI 4GB 128bit GDDR5 800MHz 512processors PCIExpress 3.0*16 video cards 6 Screen Graphics Card  DirectX12 6*HDMI compatible graphics card of Desktop,$199.00 –
51RISC GTX1660Super 6GB Gaming Video Card GTX1660 6GB Graphics Cards GPU Desktop Computer Game 1060,$159.00 –
51RISC Graphics Card RTX3070 8GB NVIDIA GPU 12Pin GDDR6 256bit HDMI*1 DP*3 PCI-E 4.0 x16 rtx3070 8gb Gaming Video card,$499.00 –
51RISC GeForce RTX 2060 6GB GDDR6 PCIE16 Graphics Cards RTX2060 6G for Computer office Components video Cards gaming,$209.00 –
MAXSUN Nvidia Geforce RTX 3080 Ti iCraft GM OC 12GB GDDR6X Video Graphics Card GPU For Computer Gaming PC HDMI2.1 PCIE 4.0,$1,099.99 –
MSI Ventus GeForce RTX 3060 12GB GDDR6 PCI Express 4.0 Video Card RTX 3060 Ventus 2X 12G OC,$359.99 (20 Offers)–
MSI Gaming GeForce RTX 4070 Ti 12GB GDDR6X PCI Express 4.0 Video Card RTX 4070 Ti GAMING X TRIO 12G,$879.99 (11 Offers)–
MAXSUN GeForce RTX 3060 Ti OC 8G iCraft Limited Edition Anime GPU Computer Graphics Card For Gaming PC 256-Bit PCI Express X16 4.0 HDMI 2.1 GDDR6 Video Gaming Graphics Cards,$469.99 –
GIGABYTE Gaming GeForce RTX 4090 24GB GDDR6X PCI Express 4.0 x16 ATX Video Card GV-N4090GAMING OC-24GD,$1,699.99 (8 Offers)–
MSI Suprim GeForce RTX 4090 24GB GDDR6X PCI Express 4.0 Video Card RTX 4090 SUPRIM LIQUID X 24G,$2,139.00 (8 Offers)–
Yeston Radeon RX 7900 XTX 24GD6 GDDR6 384bit 5nm video cards Desktop computer PC Video Graphics Cards support PCI-Express 4.0 3*DP+1*HDMI-compatible RGB light effect Fragrant graphics card,$1,499.00 –
GIGABYTE Gaming GeForce RTX 3070 Ti 8GB GDDR6X PCI Express 4.0 ATX Video Card GV-N307TGAMING OC-8GD,$639.99 (14 Offers)–
MAXSUN Nvidia Geforce RTX 4070 Ti iCraft Limited Edition OC 12GB GDDR6X Video Graphics Card GPU For Computer Gaming PC HDMI2.1 PCIE 4.0 X16,$1,099.99 –
GIGABYTE GeForce RTX 4070 Ti AERO OC 12G Graphics Card, 3x WINDFORCE Fans, 12GB 192-bit GDDR6X, GV-N407TAERO OC-12GD Video Card,$899.99 –
PNY GeForce RTX 4070 12GB VERTO Dual Fan Graphics Card DLSS 3,$599.99 –
MAXSUN Geforce RTX 3070 8GB GDDR6 Gaming Video Graphics Card PCIE 4.0 HDMI2.1 GPU Dual Fans Graphics Cards,$499.99 –
Yeston Radeon RX 7900 XT 20GD6 GDDR6 320bit 5nm video cards Desktop computer PC Video Graphics Cards support PCI-Express 4.0 3*DP+1*HDMI-compatible RGB light effect Fragrant graphics card,$999.00 –
BIOSTAR NEW GeForce RTX 3080 10GB GDDR6X PCI Express 4.0 Graphics Card NVIDIA RTX 3080 10GB Gaming Video Card 8Pin GPU Gamer,$794.19 –
ASUS TUF Gaming NVIDIA GeForce RTX 3070 Ti OC V2 Graphics Card (PCIe 4.0, 8GB GDDR6X, HDMI 2.1, DisplayPort 1.4a, Military-grade Certification, GPU Tweak III) TUF-RTX3070TI-O8G-V2-GAMING,$629.99 (21 Offers)–
GIGABYTE GeForce RTX 4070 Ti GAMING OC 12G Graphics Card, 3x WINDFORCE Fans, 12GB 192-bit GDDR6X, GV-N407TGAMING OC-12GD Video Card,$859.99 (3 Offers)–
51RISC Graphics Card RTX3070 8GB NVIDIA GPU 12Pin GDDR6 256bit HDMI*1 DP*3 PCI-E 4.0 x16 rtx3070 8gb Gaming Video card,$499.00 –
GIGABYTE Radeon RX 6600 EAGLE 8G Graphics Card, WINDFORCE 3X Cooling System, 8GB 128-bit GDDR6, GV-R66EAGLE-8GD Video Card,$219.99 (3 Offers)–
GALAX New GeForce RTX 3060 Ti 8GB OC FG GDDR6 Gaming GPU Video Card RTX 3060TI Graphics Card,$560.99 –
51RISC RX5500XT 8G D6 Gaming Graphics Card with 8G/128bit/GDDR6 Memory 16GHz Memory Frequency DirectX12 3D Feature,$119.00 –
ASUS ROG Strix GeForce RTX 4090 OC Edition Gaming Graphics Card (PCIe 4.0, 24GB GDDR6X, HDMI 2.1a, DisplayPort 1.4a) ROG-STRIX-RTX4090-O24G-GAMING,$2,009.99 (5 Offers)–
MSI Gaming GeForce RTX 4090 24GB GDDR6X PCI Express 4.0 Video Card RTX 4090 GAMING X TRIO 24G,$1,649.99 (17 Offers)–
MSI Ventus GeForce RTX 3060 12GB GDDR6 PCI Express 4.0 Video Card RTX 3060 Ventus 3X 12G OC,$369.75 (23 Offers)–
MSI Ventus GeForce RTX 4070 Ti 12GB GDDR6X PCI Express 4.0 Video Card RTX 4070 Ti VENTUS 3X 12G,$814.99 (6 Offers)–
GIGABYTE Gaming OC GeForce RTX 3070 8GB GDDR6 PCI Express 4.0 ATX Video Card GV-N3070GAMING OC-8GD (rev. 2.0) (LHR),$529.99 (23 Offers)–
XFX SPEEDSTER MERC310 Radeon RX 7900 XTX 24GB GDDR6 PCI Express 4.0 x16 Video Card RX-79XMERCB9,$999.99 (3 Offers)–
GIGABYTE Radeon RX 6800 GAMING OC 16G Graphics Card, WINDFORCE 3X Cooling System, 16GB 256-bit GDDR6, GV-R68GAMING OC-16GD Video Card, Powered by AMD RDNA 2, HDMI 2.1,$469.99 (5 Offers)–
GIGABYTE AERO GeForce RTX 4090 24GB GDDR6X PCI Express 4.0 x16 ATX Video Card GV-N4090AERO OC-24GD,$1,749.99 –
ASRock Challenger D Radeon RX 6700 XT 12GB GDDR6 PCI Express 4.0 Video Card RX6700XT CLD 12GO,$349.99 (1 Offers)–
ASUS TUF Gaming GeForce RTX 4090 OC Edition Gaming Graphics Card (PCIe 4.0, 24GB GDDR6X, HDMI 2.1a, DisplayPort 1.4a) TUF-RTX4090-O24G-GAMING,$1,799.99 (10 Offers)–
MSI Gaming GeForce RTX 4080 16GB GDDR6X PCI Express 4.0 Video Card RTX 4080 16GB GAMING X TRIO,$1,272.99 (14 Offers)–
MSI Gaming GeForce RTX 3060 12GB GDDR6 PCI Express 4.0 Video Card RTX 3060 Gaming X 12G,$379.99 (14 Offers)–
MSI Gaming GeForce RTX 4090 24GB GDDR6X PCI Express 4.0 Video Card RTX 4090 GAMING TRIO 24G,$1,599.99 (4 Offers)–
GIGABYTE Gaming OC Radeon RX 6750 XT 12GB GDDR6 PCI Express 4.0 ATX Video Card GV-R675XTGAMING OC-12GD,$399.99 (2 Offers)–
MSI Suprim GeForce RTX 4090 24GB GDDR6X PCI Express 4.0 Video Card RTX 4090 SUPRIM X 24G,$1,749.99 (17 Offers)–
ASRock Phantom Gaming Radeon RX 7900 XT 20GB GDDR6 PCI Express 4.0 ATX Video Card RX7900XT PG 20GO,$799.99 –
MSI Mech Radeon RX 6700 XT 12GB GDDR6 PCI Express 4.0 Video Card RX 6700 XT MECH 2X 12G OC,$369.99 (5 Offers)–
ASUS TUF Gaming NVIDIA GeForce RTX 4070 Ti Gaming Graphics Card (PCIe 4.0, 12GB GDDR6X, HDMI 2.1a, DisplayPort 1.4a) TUF-RTX4070TI-12G-GAMING,$865.22 (6 Offers)–
ASUS Dual GeForce RTX 4070 12GB GDDR6X, IP5X, Auto-Extreme Technology, 144-Hour Validation Program, HDMI 2.1a, DP 1.4a, DUAL-RTX4070-12G,$599.99 –
ASRock Radeon RX 6600 8GB GDDR6 PCI Express 4.0 Video Card RX6600 CLD 8G,$219.99 (2 Offers)–
Yeston RTX 3080 10GB GDDR6X 320bit LHR Graphics cards Nvidia pci express x16 4.0 HDMI 2.1*1 + DP1.4a*3 video cards Desktop computer PC video gaming graphics card,$749.00 –
GIGABYTE WINDFORCE GeForce RTX 4070 12GB GDDR6X PCI Express 4.0 x16 ATX Video Card GV-N4070WF3OC-12GD,$599.99 (3 Offers)–
GIGABYTE AERO OC GeForce RTX 4080 16GB GDDR6X PCI Express 4.0 ATX Video Card GV-N4080AERO OC-16GD,$1,199.99 (3 Offers)–
GIGABYTE Gaming GeForce RTX 4080 16GB GDDR6X PCI Express 4.0 x16 ATX Video Card GV-N4080GAMING OC-16GD,$1,169.99 (6 Offers)–
